433ec239-51a9-417b-a9c0-32737f62ae03,44e34cd6-a9a8-49a4-969b-1632a3175dab,"汎用SSD","はんようSSD","低レイテンシーを要求するアプリ","ていれいてんしーをようきゅうするあぷり","一般的なアプリケーションに使える。仮想デスクトップや小～中規模のデータベース、開発環境に使う。サイズは1GB~16TB",FALSE,2021-02-26 22:05:00,2021-02-26 22:05:00
0f94a203-2dbc-48b7-8a97-aef711d644c0,44e34cd6-a9a8-49a4-969b-1632a3175dab,"プロビジョンドIOPS","ぷろびじょんどIOPS","最も高い性能をもつEBS","もっともたかいせいのうをもつEBS","高井I/O性能に依存するNoSQLアプリや10000IOPS,160MB/s超のワークロード大規模DB,高速なDBなどに利用。サイズは4GB=16TB",FALSE,2021-02-26 22:05:00,2021-02-26 22:05:00
381f7a76-c42b-4510-bdd9-bd14437f6b0a,44e34cd6-a9a8-49a4-969b-1632a3175dab,"スループット最適化HDD","するーぷっとさいてきかHDD","大規模なETL処理やログ分析","だいきぼなETLしょりやろぐぶんせき","ビッグデータ処理やDWH,大規模なETL処理やログ分析等に使われる。ブートボリュームには利用不可でサイズは500GB~16TB",FALSE,2021-02-26 22:05:00,2021-02-26 22:05:00
f083acad-0347-4d71-9923-b5bb963b97f6,44e34cd6-a9a8-49a4-969b-1632a3175dab,"コールドHDD","こーるどHDD","バックアップやアーカイブ","ばっくあっぷやあーかいぶ","ログデータ等アクセス頻度が低いデータに使われる。ブートボリュームには利用不可。サイズは500GB~16TB",FALSE,2021-02-26 22:05:00,2021-02-26 22:05:00
6d32b3ec-f864-417d-8ed4-e0ec19d47bac,44e34cd6-a9a8-49a4-969b-1632a3175dab,"マグネティック","まぐねてぃっく","旧世代のボリューム","きゅうせだいのぼりゅーむ","基本利用しない。データへのアクセス頻度が低いワークロード利用。サイズは1GB~1TB",FALSE,2021-02-26 22:05:00,2021-02-26 22:05:00
301e2f75-d73a-412b-bb60-fa9bbc2937de,44e34cd6-a9a8-49a4-969b-1632a3175dab,"ワークロード","わーくろーど","一連のコンポーネント","いちれんのこんぽーねんと","ウェブサイト、ECサイト、モバイルアプリのバックエンド、分析プラットフォームなどビジネス価値をもたらす一連のコンポーネントが特定する。",FALSE,2021-02-26 22:05:00,2021-02-26 22:05:00
e92ae7b0-480a-4408-b24f-3431bca61127,44e34cd6-a9a8-49a4-969b-1632a3175dab,"マイルストーン","まいるすとーん","アーキテクチャの重要な変更内容","あーきてくちゃのじゅうようなへんこうないよう","設計、テスト、実稼働、本稼働の製品ライフサイクルを通して進歩するアーキテクチャでの重要な変更内容のこと",FALSE,2021-02-26 22:05:00,2021-02-26 22:05:00
a25f6098-13f8-4f52-83fa-0eb6f696dea0,44e34cd6-a9a8-49a4-969b-1632a3175dab,"レンズ","れんず","一連のアーキテクチャ評価方法","いちれんのあーきてくちゃひょうかほうほう","ベストプラクティスに照らしてアーキテクチャを評価し、改善すべき分野を特定する一貫した方法",FALSE,2021-02-26 22:05:00,2021-02-26 22:05:00
706ef4ea-201c-457a-89cc-5e778f473a50,44e34cd6-a9a8-49a4-969b-1632a3175dab,"HRI","","高リスクの問題","こうりすくのもんだい","ビジネスに重大な悪影響を及ぼす可能性があるアーキテクチャ及び運用上の問題",FALSE,2021-02-26 22:05:00,2021-02-26 22:05:00
b3cd5e33-d2b7-4d26-abb8-fccd90e0e25d,44e34cd6-a9a8-49a4-969b-1632a3175dab,"MRI","","中リスクの問題","ちゅうりすくのもんだい","その程度はHRIより低いビジネス上の問題",FALSE,2021-02-26 22:05:00,2021-02-26 22:05:00
b5f1bccd-fc6b-402a-b94d-04fe7aac04c3,44e34cd6-a9a8-49a4-969b-1632a3175dab,"スティッキーセッション","すてぃっきーせっしょん","セッション中の同一インスタンス保持","せっしょんちゅうのどういついんすたんすほじ","セッション中に同じユーザから来たリクエストを全て同じEC2インスタンスに送信する",FALSE,2021-02-26 22:05:00,2021-02-26 22:05:00
47a76a30-696b-4bff-9d77-fa99501b76d7,44e34cd6-a9a8-49a4-969b-1632a3175dab,"Connection Draining","","異常発生による新規リクエスト送信中止","いじょうはっせいによるしんきりくえすとそうしんちゅうし","インスタンスが登録解除されるか異常が発生した場合に、そのバックエンドインスタンスへの新規リクエスト送信を中止する",FALSE,2021-02-26 22:05:00,2021-02-26 22:05:00
5bed718a-12eb-4f06-85f7-c441e3c386ba,44e34cd6-a9a8-49a4-969b-1632a3175dab,"S3へのログ保管","S3へのろぐほかん","S3への自動保管","S3へのじどうほかん","ELBのアクセスログを指定してS3へ自動保管できる",FALSE,2021-02-26 22:05:00,2021-02-26 22:05:00
c051fd08-5706-4053-8044-2c1ea492047b,44e34cd6-a9a8-49a4-969b-1632a3175dab,"CLB","","Classic Load Balancer","","初期に提供されたELBであり、標準的なL4/L7におけるロードバランシングが可能だが複雑な設定はできない",FALSE,2021-02-26 22:05:00,2021-02-26 22:05:00
6aed22e1-ff0d-4531-b0c9-fcf220942503,44e34cd6-a9a8-49a4-969b-1632a3175dab,"ALB","","Application Load Balancer","","L7の対応が強化された単一ロードバランサーで、異なるアプリケーションへリクエストをルーティングが可能",FALSE,2021-02-26 22:05:00,2021-02-26 22:05:00
4068de40-e596-4b48-9205-9e395f05a423,44e34cd6-a9a8-49a4-969b-1632a3175dab,"NLB","","Network Load Balancer","","NLBは超低遅延で高スループットを維持しながら秒間何百万リクエストを捌くように設計された新しいロードバランサー",FALSE,2021-02-26 22:05:00,2021-02-26 22:05:00